{"schema":"https://debz.dev/schema/repository-operation-result-v1","version":1,"api_version":1,"operation":"add","acquired":"pending","validated":"pending","authenticated":"pending","planned":"pending","installed_phase":"pending","imported":"pending","refreshed_phase":"pending","changed":false,"installed":false,"refreshed":false,"descriptor":null,"paths":{"exact_lock":null,"provenance":null,"target_manifest":null,"operation_state":null},"exit_status":2,"summary":"invalid request","diagnostics":[{"id":"invalid_request","phase":"request","message":"invalid request"}],"digest_sha256":"175d390ccebf9e2af76a0e41746953faf8ecb2e88ad7b997a4c33b2eea2e8c1f"}